{
  "$schema": "./condizioni-arresto.schema.json",
  "schema_version": "1.0",
  "updated_at": "2026-09-27",
  "default_actions": {
    "commit_allowed": false,
    "push_allowed": false,
    "deployment_checked": false,
    "log_required": true
  },
  "conditions": [
    {
      "code": "STOP-REPOSITORY-NOT-CLEAN",
      "order": 10,
      "phase": "preflight",
      "category": "technical",
      "trigger": "Il working tree contiene modifiche o file non tracciati non prodotti dall'esecuzione corrente.",
      "outcome": "intervention_required",
      "retry": "manual",
      "notification": "failed_runs_only",
      "repository_state": "unchanged",
      "evidence": ["git status --porcelain", "branch corrente"],
      "recovery": "Identificare il proprietario delle modifiche e ripristinare consapevolmente un working tree pulito prima di una nuova esecuzione."
    },
    {
      "code": "STOP-WRONG-BRANCH",
      "order": 20,
      "phase": "preflight",
      "category": "technical",
      "trigger": "L'automazione schedulata non si trova su main oppure HEAD non corrisponde allo stato previsto per l'avvio.",
      "outcome": "intervention_required",
      "retry": "manual",
      "notification": "failed_runs_only",
      "repository_state": "unchanged",
      "evidence": ["branch corrente", "HEAD iniziale"],
      "recovery": "Riportare l'ambiente automatico sul branch main corretto senza reset distruttivi e rieseguire soltanto dopo verifica manuale."
    },
    {
      "code": "STOP-FETCH-FAILED",
      "order": 30,
      "phase": "preflight",
      "category": "technical",
      "trigger": "Non è possibile aggiornare i riferimenti remoti o determinare in modo affidabile lo stato di origin/main.",
      "outcome": "failed",
      "retry": "next_schedule",
      "notification": "failed_runs_only",
      "repository_state": "unchanged",
      "evidence": ["comando Git fallito", "messaggio di errore", "HEAD iniziale"],
      "recovery": "Lasciare il repository invariato e riprovare alla schedulazione successiva; richiedere intervento se l'errore persiste."
    },
    {
      "code": "STOP-MAIN-NOT-FAST-FORWARD",
      "order": 40,
      "phase": "preflight",
      "category": "concurrency",
      "trigger": "main è divergente da origin/main o non può essere aggiornato esclusivamente con fast-forward.",
      "outcome": "intervention_required",
      "retry": "manual",
      "notification": "failed_runs_only",
      "repository_state": "unchanged",
      "evidence": ["HEAD locale", "SHA origin/main", "merge-base"],
      "recovery": "Risolvere manualmente la divergenza e confermare uno stato lineare; sono vietati force push e reset distruttivi automatici."
    },
    {
      "code": "STOP-ACTIVE-EDITORIAL-LOCK",
      "order": 50,
      "phase": "preflight",
      "category": "concurrency",
      "trigger": "Un'altra esecuzione editoriale possiede un lock valido e risulta ancora attiva.",
      "outcome": "deferred",
      "retry": "next_schedule",
      "notification": "none",
      "repository_state": "unchanged",
      "evidence": ["identificatore lock", "proprietario", "data di acquisizione"],
      "recovery": "Terminare senza modifiche e lasciare che la successiva schedulazione ripeta il controllo del lock."
    },
    {
      "code": "STOP-STALE-EDITORIAL-LOCK",
      "order": 60,
      "phase": "preflight",
      "category": "concurrency",
      "trigger": "Esiste un lock editoriale privo di un'esecuzione attiva verificabile o oltre la validità definita dal runbook.",
      "outcome": "intervention_required",
      "retry": "manual",
      "notification": "failed_runs_only",
      "repository_state": "unchanged",
      "evidence": ["contenuto lock", "data di acquisizione", "stato esecuzione associata"],
      "recovery": "Verificare manualmente l'esecuzione precedente e rimuovere il lock soltanto dopo aver escluso attività concorrenti."
    },
    {
      "code": "STOP-EDITORIAL-DATA-INVALID",
      "order": 70,
      "phase": "preflight",
      "category": "technical",
      "trigger": "Backlog, registro fonti, condizioni di arresto o altre strutture editoriali non superano i validatori automatici.",
      "outcome": "intervention_required",
      "retry": "manual",
      "notification": "failed_runs_only",
      "repository_state": "unchanged",
      "evidence": ["comando validatore", "codice di uscita", "elenco errori"],
      "recovery": "Correggere i dati versionati e rieseguire la validazione completa prima di riattivare il ciclo editoriale."
    },
    {
      "code": "STOP-NO-ELIGIBLE-GUIDE",
      "order": 80,
      "phase": "selection",
      "category": "normal",
      "trigger": "Nessuna voce del backlog soddisfa contemporaneamente stato, modalità, priorità e dipendenze richieste.",
      "outcome": "no_op",
      "retry": "next_schedule",
      "notification": "none",
      "repository_state": "unchanged",
      "evidence": ["criteri di selezione", "numero candidati", "dipendenze non concluse"],
      "recovery": "Terminare senza modifiche; una futura esecuzione ripeterà la selezione dopo eventuali aggiornamenti del backlog."
    },
    {
      "code": "STOP-DUPLICATE-OR-CANNIBALIZATION",
      "order": 90,
      "phase": "selection",
      "category": "editorial",
      "trigger": "Slug, intento, query principale o contenuto previsto duplicano o cannibalizzano sostanzialmente una pagina esistente.",
      "outcome": "intervention_required",
      "retry": "manual",
      "notification": "failed_runs_only",
      "repository_state": "unchanged",
      "evidence": ["guida candidata", "pagina in conflitto", "elementi sovrapposti"],
      "recovery": "Rivedere, unire, riposizionare o scartare esplicitamente la voce nel backlog prima di una nuova esecuzione."
    },
    {
      "code": "STOP-ELIGIBILITY-CHANGED",
      "order": 100,
      "phase": "selection",
      "category": "concurrency",
      "trigger": "La guida selezionata o una sua dipendenza cambia stato prima dell'inizio della redazione.",
      "outcome": "deferred",
      "retry": "next_schedule",
      "notification": "none",
      "repository_state": "unchanged",
      "evidence": ["stato selezionato iniziale", "stato corrente", "SHA del backlog"],
      "recovery": "Rilasciare il lock e ripetere la selezione dalla versione aggiornata del backlog nella prossima esecuzione."
    },
    {
      "code": "STOP-SOURCES-INSUFFICIENT",
      "order": 110,
      "phase": "research",
      "category": "editorial",
      "trigger": "Le fonti reperite non sostengono tutte le affermazioni centrali con il livello di affidabilità richiesto.",
      "outcome": "intervention_required",
      "retry": "manual",
      "notification": "failed_runs_only",
      "repository_state": "local_artifacts_allowed",
      "evidence": ["affermazioni senza supporto", "fonti esaminate", "limiti riscontrati"],
      "recovery": "Correggere la causa nello stesso run oppure usare quarantine per archiviare gli artefatti, marcare la guida blocked e consentire alla schedulazione successiva di avanzare."
    },
    {
      "code": "STOP-SOURCE-UNAVAILABLE",
      "order": 120,
      "phase": "research",
      "category": "technical",
      "trigger": "Una fonte indispensabile non è accessibile integralmente o non consente di verificarne identità, data e contenuto.",
      "outcome": "failed",
      "retry": "next_schedule",
      "notification": "failed_runs_only",
      "repository_state": "local_artifacts_allowed",
      "evidence": ["URL fonte", "momento del tentativo", "errore di accesso"],
      "recovery": "Sostituire la fonte nello stesso run oppure usare quarantine; la guida blocked sarà recuperata separatamente dopo l'esaurimento delle voci ready."
    },
    {
      "code": "STOP-SOURCE-CONFLICT",
      "order": 130,
      "phase": "research",
      "category": "editorial",
      "trigger": "Fonti autorevoli divergono su un'affermazione centrale e il conflitto non può essere risolto o rappresentato correttamente.",
      "outcome": "intervention_required",
      "retry": "manual",
      "notification": "failed_runs_only",
      "repository_state": "local_artifacts_allowed",
      "evidence": ["identificatori fonti", "affermazione controversa", "natura del conflitto"],
      "recovery": "Documentare il conflitto e, se non risolvibile nel run, usare quarantine; la decisione editoriale avverrà nel recupero separato della guida blocked."
    },
    {
      "code": "STOP-HIGH-RISK-CLAIM-UNSUPPORTED",
      "order": 140,
      "phase": "research",
      "category": "editorial",
      "trigger": "Una spiegazione fiscale, previdenziale, normativa o finanziaria ad alto rischio resta ambigua, non aggiornata o non supportata da fonti idonee.",
      "outcome": "intervention_required",
      "retry": "manual",
      "notification": "failed_runs_only",
      "repository_state": "local_artifacts_allowed",
      "evidence": ["affermazione ad alto rischio", "data di validità", "fonte mancante o ambigua"],
      "recovery": "Rimuovere o sostenere l'affermazione nello stesso run; altrimenti usare quarantine e rinviare la guida blocked al recupero separato."
    },
    {
      "code": "STOP-EDITORIAL-POLICY-VIOLATION",
      "order": 150,
      "phase": "drafting",
      "category": "editorial",
      "trigger": "La bozza viola politica editoriale, politica delle fonti, template, originalità o limiti sulla consulenza personale.",
      "outcome": "intervention_required",
      "retry": "manual",
      "notification": "failed_runs_only",
      "repository_state": "local_artifacts_allowed",
      "evidence": ["regola violata", "passaggio interessato", "controllo che ha rilevato il problema"],
      "recovery": "Correggere integralmente la violazione nello stesso run oppure usare quarantine e rinviare la guida blocked al recupero separato."
    },
    {
      "code": "STOP-GENERATION-FAILED",
      "order": 160,
      "phase": "generation",
      "category": "technical",